{"id":"jetbrains","name":"JetBrains IDE","layer":"editor","source":"https://www.jetbrains.com/help/idea/settings-tools-terminal.html","inspection":"Check the active IDE keymap and Terminal > Override IDE shortcuts. Ctrl+K is Commit in the default Windows keymap; other keymaps vary.","bindings":[{"key":"ctrl+k","owner":"IDE shortcut (Commit on default Windows keymap)","status":"possible"}]}
