{"id":"vscode","name":"VS Code","layer":"editor","source":"https://code.visualstudio.com/docs/terminal/advanced","inspection":"Open Keyboard Shortcuts and inspect Ctrl+K plus terminal.integrated.commandsToSkipShell and terminal.integrated.allowChords. Extensions and user bindings may change the effective result.","bindings":[{"key":"ctrl+k","owner":"VS Code chord prefix","status":"documented-default"}]}
